{
  "schema_version": "constitution.v1",
  "generated_at": "2026-02-23T23:25:54.963Z",
  "generator_version": "0.5.0",
  "user_scope": "single_user",
  "principles": [
    {
      "id": "apply_user_taste",
      "priority": 1,
      "statement": "Apply the user's general taste and preferences when no specific principle applies.",
      "rationale": "Placeholder fixture principle. Real constitutions have user-derived principles.",
      "applies_to": [
        "*"
      ]
    }
  ],
  "tone": {
    "voice_keywords": [],
    "forbidden_phrases": [],
    "formatting_rules": []
  },
  "tradeoffs": {
    "accuracy_vs_speed": 0.5,
    "cost_sensitivity": 0.5,
    "autonomy_level": 0.5
  },
  "evidence_policy": {
    "require_citations_for": [],
    "uncertainty_language_rules": []
  },
  "taboos": {
    "never_do": [],
    "must_escalate": []
  },
  "trace_map": {
    "_session_id": "5bae660c-6484-423d-b4b4-f9721e16e8d1",
    "_llm_provider": {
      "name": "ollama"
    },
    "_domain_id": "content-agent",
    "_tone": {
      "source_dimensions": []
    },
    "_tradeoffs": {
      "source_dimensions": []
    },
    "_evidence_policy": {
      "source_dimensions": []
    },
    "_taboos": {
      "source_dimensions": []
    }
  }
}
